,image_id,ques_id,question,answer,answer,answer,answer,answer,answer,answer,answer,answer,answer
472,262273,262273005,How many people are there?,1,1,1,1,1,1,1,1,1,1
473,262273,262273006,Is it summer?,no,no,no,no,no,no,no,no,no,no
474,262273,262273007,What color is the man's hat?,black and gray,black,black,black,black,black,black,black,black,black
475,262273,262273008,How many people are in the image?,1,1,1,1,1,1,1,1,1,1
476,524420,524420000,What color is the woman's shorts?,black,black,black,black,black,black,black,black,black,black
477,524420,524420001,Is the picture in color?,yes,yes,yes,yes,yes,yes,yes,yes,yes,yes
478,524420,524420002,Is there a dog in the photo?,yes,yes,yes,yes,yes,yes,yes,yes,yes,yes
479,524420,524420003,Is the dog on a leash?,yes,yes,yes,yes,yes,yes,yes,yes,yes,yes
480,524420,524420004,What are the people doing in the street?,walking,walking,walking,walking,walking,walking,walking,walking,walking,walking
481,436929,436929000,What is floating near the bird?,ice,foam,water,fog,ice,ice,foam,nothing,ice,fish
482,436929,436929001,Are all of the birds in flight?,no,no,no,no,no,no,no,no,no,no
483,436929,436929002,How many birds are there?,3,3,2,3,3,3,3,3,3,3
484,436929,436929003,Are there three birds in the picture?,yes,no,yes,yes,yes,yes,3,yes,yes,yes
485,436929,436929004,Is this a dog?,no,no,no,no,no,no,no,no,no,no
486,436929,436929005,Is this a winter scene?,yes,yes,yes,yes,yes,yes,yes,yes,yes,yes
487,436929,436929006,Is the water frozen?,yes,no,yes,no,yes,no,yes,no,yes,no
488,131208,131208000,Why are there so many clothes on the bed?,she just did laundry,laundry,lack of storage,she does not want to put them away,it's hot,she's messy,haven't put away yet,messy,bed isn't made,yes
489,131208,131208001,Is that a laptop on the chair?,yes,yes,yes,yes,yes,yes,yes,yes,yes,yes
490,131208,131208002,What color is the girl's hair?,red,red,pink,red,red,orange,red,red,red,red
491,284012,284012000,What brand of soda is advertised?,pepsi,pepsi,pepsi,pepsi,pepsi,pepsi,pepsi,pepsi,pepsi,pepsi
492,284012,284012001,Is Cingular a sponsor of this field?,yes,yes,yes,yes,yes,yes,yes,yes,yes,yes
493,284012,284012002,What Mexican food restaurant chain is advertised?,del taco,panda express,del taco,del taco,del taco,del taco,del taco,del taco,del taco,del taco
494,284012,284012003,How is the turnout?,great,good,good,good,hundreds,high,great,high,fair,decent
495,284012,284012004,How many men are playing baseball?,5,6,4,several,4,5,5,5,5,5
496,284012,284012005,What is the large sculpture next to the oversized cola bottle?,panda,marquee,building,panda express,scoreboard,panda express logo,scoreboard,building,billboard,panda
497,284012,284012006,What color is the catcher's pants?,gray,gray,white,gray,gray,gray,gray,gray,gray,gray
498,138,138000,How many pots are hanging under the shelf?,2,2,2,2,2,2,2,2,2,2
499,138,138001,What time is it?,1:50,1:50,older,1:50,1:51,1:55,1:50,1:50,1:50,2:50
500,138,138002,Is this a conventional kitchen?,no,no,no,no,yes,no,no,no,no,yes
501,262283,262283000,What color flowers are on the top right?,purple,purple,pink,purple,pink,purple and pink,purple,purple,purple,purple
502,262283,262283001,Is the area lit?,yes,yes,yes,yes,yes,yes,yes,yes,yes,yes
503,262283,262283002,Where was this shot at?,florist,florist,flower shop,florist,flower shop,florist,flower shop,flower shop,florist,florist
504,262283,262283003,Are the vases identical?,no,no,no,no,yes,no,yes,no,yes,yes
505,524428,524428000,Are these the normal size pieces of pizza?,yes,no,yes,yes,yes,yes,yes,no,no,no
506,524428,524428001,Could you eat all of this pizza?,no,no,no,no,yes,yes,yes,no,no,no
507,524428,524428002,Is there broccoli on a slice of pizza?,yes,no,yes,yes,no,no,yes,yes,no,no
508,524428,524428003,What color is the cloth?,gray,gray,gray,gray,gray,white,gray,gray,gray,gray
509,262285,262285000,How many zebras are there?,7,14,13,10,7,8,14,9,13,12
510,262285,262285001,What continent might this be?,africa,africa,africa,africa,africa,africa,africa,africa,africa,africa
511,262285,262285002,Is there an animal that seems to stick out?,no,zebras,no,no,on right,no,no,zebra,no,no
512,262285,262285003,Is this in a zoo?,no,no,no,no,no,no,no,no,no,no
513,262285,262285004,Is this in a desert?,yes,no,yes,yes,no,no,yes,no,yes,no
514,142,142000,What type of fruit is on the plate?,banana,banana,banana,banana,banana,banana,bananas,bananas,banana,banana
515,142,142001,Is this a banana toast?,no,no,yes,yes,yes,no,no,yes,yes,yes
516,142,142002,What color is the milk carton?,blue white,blue and white,blue,blue,blue,blue,blue,blue and white,blue,blue
517,131215,131215000,Are the people playing a game?,no,no,no,no,no,no,no,no,no,no
518,131215,131215001,Is the TV turned on?,yes,yes,yes,yes,yes,yes,yes,yes,yes,yes
519,131215,131215002,Is this person watching a movie?,yes,yes,yes,yes,yes,yes,yes,yes,yes,yes
520,131215,131215003,What is in the blue chair?,teddy bears,teddy bears,stuffed animals,teddy bears,teddy bears,teddy bears,stuffed animals,bears,dolls,dolls
521,131215,131215004,What type of footwear is the person wearing?,socks,socks,tennis shoes,sneakers,socks,socks,socks,shoes,socks,socks
522,144,144000,What are the animals doing?,drinking,drinking water,grazing,eating,eating,watching,eating,eating,eating,eating
523,144,144001,Is one of the giraffes eating?,yes,yes,yes,yes,yes,yes,yes,yes,no,yes
524,144,144002,What type of animal is in the picture?,giraffe,giraffe,giraffe,giraffe,giraffe,giraffe,giraffes,giraffe,giraffe,giraffe
525,393362,393362000,Is it daytime?,yes,yes,yes,yes,yes,yes,yes,yes,yes,yes
526,393362,393362001,Are the kickstands down?,yes,yes,yes,yes,yes,yes,yes,yes,yes,yes
527,393362,393362002,Do you see any motorcycle helmets?,yes,yes,yes,yes,no,no,yes,no,yes,yes
528,149,149000,Is the kite high in the air?,yes,yes,yes,yes,yes,yes,yes,yes,yes,yes
529,149,149001,Is the sky clear?,no,no,yes,no,yes,no,no,no,no,yes
530,149,149002,What color is the building?,red,red,brown,red,red,red,red brick,brown,brown,red
531,149,149003,Are the people flying kites?,yes,yes,yes,yes,yes,yes,yes,yes,yes,yes
532,149,149004,Which buses are double deckers?,no,0 here,ones in back,no buses,0,0,0,0,left,0
533,149,149005,What kind of court is at the edge of the field?,tennis,basketball,tennis,basketball,soccer,soccer,soccer,soccer,soccer,soccer
534,471373,471373000,Can you see any fish?,no,no,no,no,no,no,no,no,no,no
535,471373,471373001,Is this man swimming?,no,no,yes,no,no,no,yes,no,no,yes
536,471373,471373002,Is he turning?,no,no,no,no,no,no,no,no,no,no
537,471373,471373003,Does the man have short hair?,yes,yes,yes,yes,yes,yes,yes,yes,yes,yes
538,471373,471373004,What is this man laying on?,surfboard,surfboard,surfboard,surfboard,surfboard,surfboard,surfboard,surfboard,surfboard,surfboard
539,109986,109986000,What color is this girl's shirt?,red,red,red,red,red,red,red,red,red,red
540,109986,109986001,What color is the girls hot dog?,red,red,red,brown,red,red,"brown, red",red,red,red
541,109986,109986002,What color are the girl's lips?,red,red,red,red,red,red,red,red,red,red
542,131225,131225000,What does the front of the bus say at the top?,special,special,special,special,special,special,special,special,special,special
543,131225,131225001,Is the bus featured in this picture typical?,no,no,no,no,no,no,no,no,yes,no
544,131225,131225002,What color is the school bus?,blue and yellow,"yellow, blue",blue,blue & yellow,blue yellow,blue yellow,blue yellow,blue and yellow,"it is yellow, blue, white",blue and yellow and white
545,131225,131225003,Is this the latest make and model?,no,no,unknown,no,no,no,no,no,no,no
546,131225,131225004,What color is the bus?,blue and yellow,blue and yellow,blue and yellow,blue yellow white,"blue, yellow and white",yellow and blue,yellow and blue,"yellow, blue, and white",blue and yellow,"blue, white and yellow"
547,131225,131225005,Are there any building in the area?,yes,yes,yes,yes,yes,yes,yes,yes,yes,yes
548,154,154000,Is there a fence in the background?,yes,no,no,no,no,no,yes,no,no,no
549,154,154001,How many zebras can you see eating?,3,1,2,3,3,3,1,1,3,3
550,154,154002,How many kinds of animals are in this photo?,1,1,1,1,1,1,1,1,1,1
551,154,154003,Is the zebra's tail up?,yes,no,no,no,no,no,no,no,no,yes
552,154,154004,How many different types of animals are in this scene?,1,1,1,1,1,1,1,1,1,1
553,154,154005,What direction are the animals heading?,right,different,right,east,east,right,west,north,right,right
554,154,154006,Are they the same type of animal?,yes,yes,yes,yes,yes,yes,yes,yes,yes,yes
555,154,154007,Is the zebra walking or standing still?,walking,walking,standing still,walking,walking,walking,walking,walking,standing still,walking
556,154,154008,Are all zebras facing the same way?,no,no zebras,no,no,yes,no,no,no,yes,no
557,154,154009,How many animals are there?,3,3,3,3,3,3,3,3,3,3
558,154,154010,Are the zebras running?,no,no,no,no,no,no,no,no,no,no
559,154,154011,Who is in the photo?,zebras,zebras,zebras,zebras,zebras,zebras,zebra,no one,nobody,zebra
560,154,154012,Number of animals?,3,3,3,3,3,3,3,3,3,3
561,262299,262299000,Is he going to fall?,no,yes,no,no,maybe,no,no,no,no,no
562,262299,262299001,What color are the stakes in the dirt?,yellow,yellow,yellow,yellow,yellow,yellow,yellow,yellow,yellow,yellow
